{
  "status": "success",
  "conversation_id": "route-v4-test-03-existing-project-new-archive",
  "record_id": "00000000-0000-4000-8000-000000000003",
  "notion_url": "https://example.notion.site/route-v4-test-03-existing-project-new-archive-00000000000040008000000000000003",
  "error_type": null,
  "message": "archived",
  "module": "archive_conversation.append_page",
  "timestamp": "2026-08-06T18:27:08.178+02:00"
}
