{
  "status": "success",
  "conversation_id": "route-v4-test-05-beta-fixture",
  "record_id": "00000000-0000-4000-8000-000000000005",
  "notion_url": "https://example.notion.site/route-v4-test-05-beta-fixture-00000000000040008000000000000005",
  "error_type": null,
  "message": "archived",
  "module": "archive_conversation",
  "timestamp": "2026-08-06T18:42:09.384+02:00"
}
