{
  "status": "success",
  "conversation_id": "route-v4-test-06-missing-project-matching-archive",
  "record_id": "00000000-0000-4000-8000-000000000006",
  "notion_url": "https://example.notion.site/route-v4-test-06-restored-archive-00000000000040008000000000000006",
  "error_type": null,
  "message": "archived",
  "module": "archive_conversation.append_page",
  "timestamp": "2026-08-06T18:50:06.491+02:00"
}
