{
  "status": "success",
  "conversation_id": "route-v4-test-02-new-project-new-archive",
  "record_id": "00000000-0000-4000-8000-000000000002",
  "notion_url": "https://example.notion.site/route-v4-test-02-new-project-new-archive-00000000000040008000000000000002",
  "error_type": null,
  "message": "archived",
  "module": "archive_conversation",
  "timestamp": "2026-08-06T18:23:19.434+02:00"
}
